Sentence,Tag
what is the digital storage capacity of the realme c55 6gb-128gb,Informations tags
can i pay with a combination of cash and card,Non-Informations tags
what languages does your company operate in,Non-Informations tags
where can i see a live demo of your product,Non-Informations tags
what is the flash storage size of the samsung galaxy z flip4 5g 128gb,Informations tags
is it possible to redirect my package to a different address post-order,Non-Informations tags
what are the core values of your company,Non-Informations tags
do international orders come with any specific conditions,Non-Informations tags
how might i give feedback on a product after using it,Non-Informations tags
what is the storage capacity of the samsung galaxy a04s,Informations tags
how much for an samsung galaxy a04s on the current market,Informations tags
how much usable screen space does the vivo y16 4gb-128gb offer,Informations tags
what is the non-volatile memory amount in the honor x7a 6gb-128gb,Informations tags
can you specify the touchscreen size of the iphone 12 64gb,Informations tags
can you tell me the built-in storage for the vivo y16 4gb-128gb,Informations tags
what is the cost for an iphone 15 128gb,Informations tags
is it possible to set up a line of credit with your company,Non-Informations tags
please provide the sale price for a samsung galaxy a05s 128gb.,Informations tags
"could you calculate the total purchase cost for a xiaomi 13t 12gb-256gb, including taxes",Informations tags
how big is the screen of the realme c51 4gb-128gb,Informations tags
do you run a referral incentive program,Non-Informations tags
can you give me a quote for the samsung galaxy a34 5g,Informations tags
how much memory does the xiaomi redmi note 11 4gb - 128gb offer,Informations tags
"if i need to cancel an order, what is the procedure",Non-Informations tags
i would appreciate a price quotation for the oppo a58 6gb-128gb.,Informations tags
how much have the iphone 11 64gb models sold for in the past month,Informations tags
what is the process for checking the progress of my order,Non-Informations tags
what is the market value of this xiaomi 13 lite 8gb-128gb,Informations tags
what price bracket does the samsung galaxy a14 5g fall into,Informations tags
can you tell me the built-in storage for the oppo find n2 flip,Informations tags
can the delivery address be changed after the order is placed,Non-Informations tags
how much rom does the samsung galaxy a54 5g 128gb have,Informations tags
what is the bottom price you can offer for the realme c55 6gb-128gb,Informations tags
what is the inch measurement of the honor x7a 6gb-128gb display,Informations tags
where can i view my previous orders,Non-Informations tags
i am on a strict budget; what is the lowest price for a samsung galaxy z flip4 5g 256gb bespoke edition,Informations tags
what is the retail price for the vivo v25e 8gb,Informations tags
what would the xiaomi redmi note 11 4gb-128gb cost me,Informations tags
what options do i have for making payments,Non-Informations tags
when was your company founded,Non-Informations tags
what is the display area of the oppo a17k 3gb-64gb screen,Informations tags
how much would one have to pay for an samsung galaxy z flip5 5g 256gb,Informations tags
why am i seeing a transaction failed notice,Non-Informations tags
what is the charge for the iphone 11 64gb,Informations tags
who can i talk to about help with setting up a new product,Non-Informations tags
can you tell me the memory space available on the honor x8a 8gb-128gb,Informations tags
"what are the prices for budget-friendly phones, for example, the nokia c32",Informations tags
do you offer any subscription-based services,Non-Informations tags
can you quote the price for the samsung galaxy s22 5g 128gb,Informations tags
what payment methods do you support,Non-Informations tags
which payment method is the fastest,Non-Informations tags
"what does the samsung galaxy a04s run for, price-wise",Informations tags
what is the visual display size of the realme c55 6gb-128gb,Informations tags
how much usable screen space does the oppo a58 6gb-128gb have,Informations tags
where can i buy your products locally,Non-Informations tags
what's the method to create a wishlist online,Non-Informations tags
could you tell me the price of the iphone 14 128gb,Informations tags
thanks,Non-Informations tags
what amount should i expect to pay for the iphone 15 pro max 256gb,Informations tags
how big is the phone size of the samsung galaxy a14 4g,Informations tags
what is the onboard storage of the iphone 11 64gb,Informations tags
what is the going rate for the vivo y15s 3gb - 32gb,Informations tags
what is the expense for a samsung galaxy a53 5g 256gb,Informations tags
how do i add a new payment method,Non-Informations tags
what amount would one pay for a honor x8a 8gb-128gb in the current market,Informations tags
"please compute the total purchase amount for a vivo y15s 3gb - 32gb, including tax.",Informations tags
what is the storage amount on the samsung galaxy a14 5g,Informations tags
how much non-volatile memory does the oppo a78 8gb-256gb contain,Informations tags
what is the storage of the samsung galaxy z fold4 5g 256gb,Informations tags
do i need to create an account to make a payment,Non-Informations tags
how do i go about pre-ordering an item that is not yet available,Non-Informations tags
"for the oppo reno10 5g 256gb, what is the list price",Informations tags
what is the price point for the iphone 15 pro 128gb at the moment,Informations tags
can you point me to the price point for budget phones such as the xiaomi redmi 12c 4gb - 64gb,Informations tags
could you provide the rate for the vivo v25 5g 8gb-128gb,Informations tags
are there tutorial videos available for your products,Non-Informations tags
what is the amount i need to pay for the oppo reno8 t 4g 256gb,Informations tags
what is the full screen size of the samsung galaxy z flip5 5g 256gb,Informations tags
how are you,Non-Informations tags
can you tell us about some of your key leadership team members,Non-Informations tags
how does your company approach customer service and support,Non-Informations tags
what is the visual display size of the vivo y15s 3gb - 32gb,Informations tags
what is the onboard storage for the samsung galaxy a05s 128gb,Informations tags
how large is the display on the samsung galaxy s22 5g 128gb,Informations tags
do you handle product recalls supportively,Non-Informations tags
how much would it set me back to purchase a oppo reno10 5g 256gb,Informations tags
how do i know if the chatbot accepts my discount code,Non-Informations tags
are first-time buyers entitled to any special deals,Non-Informations tags
"after my order is placed, am i able to change the delivery address",Non-Informations tags
is customer support available around the clock,Non-Informations tags
how does your company handle competition and market pressure,Non-Informations tags
what would be the total expense for the iphone 15 plus 128gb with shipping,Informations tags
how large is the touchscreen size of the iphone 14 pro max 128gb,Informations tags
what would appear on my bill if i purchased the samsung galaxy z fold4 5g 256gb,Informations tags
what are some significant milestones your company has reached,Non-Informations tags
do i need to confirm my card details with my bank,Non-Informations tags
does your website support live chat for assistance,Non-Informations tags
are you running any special promotions this season,Non-Informations tags
can i use more than one discount code on an order,Non-Informations tags
how much memory space does the samsung galaxy s23 5g 256gb offer,Informations tags
can you specify the inch measurement for the samsung galaxy a14 5g screen,Informations tags
am i able to reserve items that aren't in stock yet,Non-Informations tags
is there a payment limit when using a card,Non-Informations tags
can i save my card information for future purchases,Non-Informations tags
could you send me an invoice for the oppo find n2 flip,Informations tags
what is the full screen size of the iphone 15 pro 128gb,Informations tags
may i have the price estimation for a samsung galaxy z flip4 5g 128gb,Informations tags
can you specify the physical screen size of the xiaomi redmi 12c 4gb - 64gb,Informations tags
can i get the valuation for the samsung galaxy s23 plus 5g 256gb,Informations tags
how can i become a member of your loyalty program,Non-Informations tags
what is the display diagonal for the samsung galaxy a05s 128gb,Informations tags
what happens if my delivery arrives later than expected,Non-Informations tags
how much do i need to budget for the oppo a57 4gb-128gb,Informations tags
may i inquire about the availability of technical support for online purchases,Non-Informations tags
can you provide the screen dimensions for the iphone 14 128gb,Informations tags
can you specify the digital storage capacity for the oppo a77s 8gb-128gb,Informations tags
when will the money be deducted from my account,Non-Informations tags
what is the mission statement of your company,Non-Informations tags
could you tell me how to keep track of my delivery,Non-Informations tags
what is the storage capacity of the samsung galaxy a14 4g,Informations tags
i need an invoice for the realme c51 4gb-128gb; can you provide one,Informations tags
how big is the screen of the asus rog 6 diablo 16gb-512gb,Informations tags
what are the perks for new clients,Non-Informations tags
how large is the touchscreen size of the xiaomi 13 lite 8gb-128gb,Informations tags
can you specify the physical screen size of the samsung galaxy s23 plus 5g 256gb,Informations tags
what would be the purchase cost including taxes for the honor x7a 6gb-128gb,Informations tags
is it possible to cancel my order after i've made it,Non-Informations tags
could you provide the price range for the realme 11 pro 5g 8gb-256gb,Informations tags
i am interested to know if you have any ongoing promotional offers,Non-Informations tags
who do i contact if i am having trouble with your website,Non-Informations tags
how much should i expect to spend on the iphone 12 64gb,Informations tags
can you specify the data storage capacity for the oppo a58 6gb-128gb,Informations tags
can you tell me if there is a referral program for current customers,Non-Informations tags
could you supply the bill amount for a realme c55 6gb-128gb,Informations tags
what is the minimum spend for free shipping to apply,Non-Informations tags
what is the storage capacity of the asus rog 6 diablo 16gb-512gb,Informations tags
what is the internal storage of the vivo y22s 8gb-128gb,Informations tags
how much memory space is available on the iphone 12 64gb,Informations tags
are there any special deals when buying multiple products together,Non-Informations tags
why was my card declined,Non-Informations tags
what is the cost one would incur to get their hands on the samsung galaxy a14 4g,Informations tags
"if i were to pay retail price, how much would the samsung galaxy a23 5g cost",Informations tags
what inspired the start of your company,Non-Informations tags
could you indicate the selling price for a xiaomi redmi note 11 4gb - 128gb,Informations tags
how big is the phone size of the iphone 15 128gb,Informations tags
how does one access customer support chat on your website,Non-Informations tags
"what would the complete charge be, inclusive of delivery, for an iphone 15 pro 128gb",Informations tags
should i share my payment details with support over chat,Non-Informations tags
what is the price quotation for a xiaomi redmi note 12s 8gb-256gb,Informations tags
can you confirm the final price after all discounts for the iphone 14 pro 128gb,Informations tags
how much is an masstel hapi 30 4g,Informations tags
what is the phone display size of the iphone 14 plus 128gb,Informations tags
how large is the display diagonal of the asus rog phone 6 12gb-256gb,Informations tags
what would the cost for an vivo v25e 8gb - 128gb,Informations tags
is it possible to order a physical product catalog,Non-Informations tags
where can i leave a detailed review of product quality,Non-Informations tags
what is the full screen size of the samsung galaxy z fold4 5g 256gb,Informations tags
what is the display size of the oppo find n2 flip,Informations tags
how much memory is in the iphone 14 plus 128gb,Informations tags
what is the financial outlay for acquiring an realme c51 4gb-128gb,Informations tags
how do i leave a review for a product on your site,Non-Informations tags
do you offer technical assistance for your products,Non-Informations tags
how does one deal with expired discount vouchers,Non-Informations tags
can you tell me the onboard storage for the xiaomi redmi 12c 4gb - 64gb,Informations tags
what should i do if i need to cancel my order,Non-Informations tags
how much flash storage does the realme c51 4gb-128gb offer,Informations tags
where can i leave my thoughts on the quality of your products,Non-Informations tags
is a subscription model available for your goods or services,Non-Informations tags
what should i do to be alerted when items are back in stock,Non-Informations tags
can you state the physical screen size of the samsung galaxy a53 5g 256gb,Informations tags
can you quote me on the iphone 13 128gb,Informations tags
what budget should i allocate for purchasing the samsung galaxy a05 128gb,Informations tags
"if i am not satisfied, can i get my money back",Non-Informations tags
what is the internal storage capacity of the oppo a57 4gb-128gb,Informations tags
can you state the screen size of the oppo a55 4gb-64gb,Informations tags
what is your policy for exchanging defective goods,Non-Informations tags
can you provide details on your electronic warranties,Non-Informations tags
what is the display size of the xiaomi redmi 10a 3gb-64gb,Informations tags
is my debit card accepted,Non-Informations tags
do you support international payments,Non-Informations tags
how do i check the payment status of my order,Non-Informations tags
how has your company adapted to the digital age,Non-Informations tags
how much memory space is there in the samsung galaxy a04,Informations tags
how do i check what stage my order is at,Non-Informations tags
can i pay with multiple payment methods,Non-Informations tags
how much rom does the oppo reno10 5g 256gb have,Informations tags
how can i stop receiving emails from you,Non-Informations tags
do you have the pricing information for the samsung galaxy z flip5 5g 256gb,Informations tags
what is the phone display size of the samsung galaxy a04,Informations tags
how can i find your closest store,Non-Informations tags
what is the internal storage of the samsung galaxy s23 plus 5g 256gb,Informations tags
what steps do i follow to opt out of your marketing emails,Non-Informations tags
can you provide the screen dimensions for the honor x6a 4gb-128gb,Informations tags
how can i get notified when an out-of-stock item is available again,Non-Informations tags
what is the onboard storage of the iphone 14 128gb,Informations tags
what were the first products your company sold,Non-Informations tags
how big is the screen size of the iphone 11 64gb,Informations tags
what does the current pricing show for the honor x8a 8gb-128gb,Informations tags
do you have any exclusive promotions for different seasons,Non-Informations tags
how much does the oppo a77s 8gb-128gb sell for,Informations tags
"for an samsung galaxy z flip5 5g 256gb, what is the current price",Informations tags
do you have a program for vip clients,Non-Informations tags
can you tell me the display dimensions of the samsung galaxy a34 5g,Informations tags
could i see a demonstration of the product before buying,Non-Informations tags
what steps should i follow to place an order online,Non-Informations tags
what is the display diagonal for the xiaomi redmi note 11 4gb - 128gb,Informations tags
how much built-in storage is in the xiaomi redmi 10 2022 4gb-128gb,Informations tags
could you explain your procedures for product trials and potential returns,Non-Informations tags
how much do i need to pay for the samsung galaxy a14 4g,Informations tags
can i use paypal to pay,Non-Informations tags
could you provide the price for a samsung galaxy s23 5g 256gb,Informations tags
"if i need to return something, can i count on assistance",Non-Informations tags
may i be informed about the purchase cost for a xiaomi redmi 12c 4gb - 64gb,Informations tags
how much memory space does the vivo y15s 3gb - 32gb have,Informations tags
"if i want to purchase the xiaomi redmi note 11s 8gb - 128gb, how much should i expect to pay",Informations tags
what is the storage amount on the samsung galaxy z flip5 5g 256gb,Informations tags
can you provide the price for the samsung galaxy s22 5g 128gb,Informations tags
what would the iphone 15 pro 128gb set me back,Informations tags
can you give me the cost of the  oppo a78 8gb-256gb,Informations tags
what is the storage size of the asus rog phone 7 16gb-512gb,Informations tags
what is the display area of the iphone 14 pro 128gb screen,Informations tags
how much built-in storage does the samsung galaxy s22 5g 128gb offer,Informations tags
are there any product launches i should be looking out for,Non-Informations tags
how large is the display on the oppo a77s 8gb-128gb,Informations tags
is there an exclusive program for your most dedicated customers,Non-Informations tags
i am interested in the realme 11 4g 8gb-128gb; what's the price,Informations tags
what financial outlay is expected for the acquisition of an iphone 12 64gb,Informations tags
what is the best way to report an issue with a faulty product,Non-Informations tags
what is the flash storage size of the samsung galaxy a53 5g 256gb,Informations tags
see you again,Non-Informations tags
what are the display dimensions of the vivo y22s 8gb-128gb,Informations tags
what does a vivo v25 pro 5g 8gb-128gb cost,Informations tags
could i have the price for a samsung galaxy a04s,Informations tags
is there a fee for online payments,Non-Informations tags
what are your customer service hours,Non-Informations tags
can you tell me the display dimensions of the samsung galaxy a04s,Informations tags
what is the asking price for the iphone 14 plus 128gb,Informations tags
can i remove a saved payment method,Non-Informations tags
can you state the screen size of the iphone 15 plus 128gb,Informations tags
how can i locate the nearest shop to my current location,Non-Informations tags
could you provide the quotation for the samsung galaxy a04,Informations tags
how much does this iphone 14 product cost,Informations tags
how can i know if my payment was successful,Non-Informations tags
what sort of support do you offer for issues with online orders,Non-Informations tags
has your company ever pivoted or rebranded,Non-Informations tags
what is the screen size of the iphone 15 pro max 256gb,Informations tags
"at checkout, how do i use a promo code",Non-Informations tags
what is the storage size of the iphone 15 128gb,Informations tags
who are the founders of your company,Non-Informations tags
when is the next sales event scheduled,Non-Informations tags
how might i get in touch with customer service,Non-Informations tags
can you specify the inch measurement for the honor x8a 8gb-128gb screen,Informations tags
how much memory is in the asus rog phone 6 12gb-256gb,Informations tags
"i am curious about the pricing for economical handsets like the nokia c32, what are the figures",Informations tags
what is the price for the iphone 14 pro max 128gb,Informations tags
could you suggest a product that would suit my needs,Non-Informations tags
what would the expenditure be for a samsung galaxy z flip4 5g 128gb,Informations tags
"i would like to know the selling price of the asus rog phone 7 16gb-512gb, could you assist",Informations tags
could you inform me about the cost of a xiaomi redmi 10 2022 4gb-128gb,Informations tags
hello,Non-Informations tags
how does your price match guarantee work,Non-Informations tags
what is the price tag for the vivo y22s 8gb-128gb,Informations tags
how can i verify the status of a repair i've requested,Non-Informations tags
is gift wrapping a service you can provide,Non-Informations tags
what are the steps to follow for tracking a return,Non-Informations tags
how much built-in storage is available on the oppo a17k 3gb-64gb,Informations tags
how do i stay informed about the stock status of products,Non-Informations tags
how much usable screen space does the samsung galaxy z fold5 5g 256gb have,Informations tags
what is the price estimation for a honor x6a 4gb-128gb,Informations tags
what is the physical size of the xiaomi redmi 10 2022 4gb-128gb  display,Informations tags
what is the display area of the samsung galaxy a54 5g 128gb,Informations tags
what is the financial requirement for this oppo a17k 3gb-64gb,Informations tags
could you tell me the cost of owning a samsung galaxy a14 5g,Informations tags
i am working with a tight budget; what is the best quotation you can give for the samsung galaxy a05s 128gb,Informations tags
how much non-volatile memory is in the samsung galaxy a34 5g,Informations tags
what is the selling price for the asus rog 6 diablo 16gb-512gb,Informations tags
what is the most popular product your company has ever sold,Non-Informations tags
can your products be found in brick-and-mortar stores,Non-Informations tags
do you provide a faster shipping option,Non-Informations tags
how many employees does your company have,Non-Informations tags
can i receive your product catalog through the mail,Non-Informations tags
is there a chance to receive a discount when making a purchase,Non-Informations tags
what kind of warranty comes with your products,Non-Informations tags
what is the story behind your company slogan,Non-Informations tags
what is your latest policy on items that arrive damaged,Non-Informations tags
what information do i need to pay with a card,Non-Informations tags
how does your company balance profit and purpose,Non-Informations tags
how can i contribute to your product feedback program,Non-Informations tags
hey,Non-Informations tags
what is the internal storage capacity of the oppo a55 4gb-64gb,Informations tags
how much should i budget for an iphone 13 128gb,Informations tags
what is the process for creating a new user account on your site,Non-Informations tags
what is the non-volatile memory amount in the iphone 15 plus 128gb,Informations tags
where can i sign up to participate in your survey for customer feedback,Non-Informations tags
how big is the screen diagonal of the oppo reno10 5g 256gb,Informations tags
how much is the going rate for a xiaomi redmi note 11 4gb - 128gb,Informations tags
what is the current selling price for the iphone 15 pro max 256gb,Informations tags
can you inform me how much i would pay for an samsung galaxy a54 5g 128gb,Informations tags
what would the purchase cost be for a samsung galaxy a34 5g,Informations tags
do you have a girlfriend,Non-Informations tags
how much for a samsung galaxy z fold5 5g 256gb,Informations tags
how should i go about applying a promotional code at the time of checkout,Non-Informations tags
"on my bill for the realme 11 pro 5g 8gb-256gb, what amount should i anticipate",Informations tags
i am considering purchasing an iphone 12 64gb; what should my budget be,Informations tags
is there an option to place orders as a group for a discount,Non-Informations tags
how does one create a wishlist on your website,Non-Informations tags
at what price do you sell the honor x8a 8gb-128gb,Informations tags
"for the iphone 11 64gb, what would the price be",Informations tags
what is done about items damaged during shipping,Non-Informations tags
what is the rom size of the xiaomi redmi 10a 3gb-64gb,Informations tags
can i choose a payment date for my order,Non-Informations tags
how big is the screen diagonal of the oppo a57 4gb-128gb,Informations tags
how is your company different from its competitors,Non-Informations tags
where can i view my payment history,Non-Informations tags
do you offer instructional content online,Non-Informations tags
at what price point do you offer the honor x8a 8gb-128gb,Informations tags
what is the cost range for a honor x9a 5g 8gb-256gb,Informations tags
what is the storage capacity of the samsung galaxy z fold4 5g 256gb,Informations tags
how much flash storage is in the iphone 14 pro max 128gb,Informations tags
can i pay with an international card,Non-Informations tags
can you tell me the onboard storage for the samsung galaxy z fold5 5g 256gb,Informations tags
can you specify the digital storage capacity of the honor x6a 4gb-128gb,Informations tags
"what is the final cost, including shipping, for an iphone 15 plus with 128gb storage",Informations tags
may i get the pricing details for the asus rog phone 6 12gb-256gb,Informations tags
what is the method for posting a review of a product i have used,Non-Informations tags
how can i go about modifying my order's shipping details,Non-Informations tags
i am looking for the top price i would have to pay for a high-end phone like the iphone 15 plus 128gb.,Informations tags
how has customer feedback shaped your company,Non-Informations tags
how much memory does the xiaomi 13 lite 8gb-128gb have,Informations tags
when is your next product release expected,Non-Informations tags
can you specify the digital storage capacity for the iphone 14 pro 128gb,Informations tags
who can i speak with for support with installation,Non-Informations tags
how might i obtain a duplicate of my receipt,Non-Informations tags
what is the history of your company,Non-Informations tags
what is the internal storage of the iphone 15 pro max 256gb,Informations tags
what is the screen size of the oppo a78 8gb-256gb,Informations tags
what is the storage capacity of the oppo reno8 t 4g 256gb,Informations tags
what is the cost of the honor x9a 5g 8gb-256gb,Informations tags
