Sentence,Tag
"after applying all available discounts, what does the final price look like for an samsung galaxy z fold4 5g 256gb",Informations tags
what should i do if there is a payment issue,Non-Informations tags
is online order tracking an option you offer,Non-Informations tags
what is the diagonal length of the asus rog phone 7 16gb-512gb display,Informations tags
can i make a payment using reward points,Non-Informations tags
what is the list price for the vivo y16 4gb-128gb,Informations tags
what is the rom size of the iphone 15 pro 128gb,Informations tags
what would be my total expenditure for purchasing the vivo y02 2gb-32gb,Informations tags
what is the physical size of the samsung galaxy z flip4 5g 128gb display,Informations tags
what assistance do you offer for monitoring orders,Non-Informations tags
how do i find out the exact amount to be paid,Non-Informations tags
what is the diagonal length of the oppo reno8 t 4g 256gb display,Informations tags
